<resultWorker
    xmlns="resultWorker"
    xmlns:xsi="http://www.w3.org/2001/XMLSchema-instance"
    xsi:schemaLocation="resultWorker validation/resultWorker.xsd">
    <output location="/tmp/results">
        <sqlLite enabled="true" clear="true" />
        <logFile enabled="true" clear="true" verbose="true" />
        <csvFile enabled="true" clear="true" />
        <fileSystem enabled="true">
            <clear>true</clear>
            <archive>
                <name>resultsPackage</name>
                <format>tar.gz</format>
                <location>/tmp/results</location>
            </archive>
        </fileSystem>
        <trmsLoggers></trmsLoggers>
    </output>
    <customLogFilters></customLogFilters>
</resultWorker>
